{
  "$schema": "./schemas/ci-policy.v1.schema.json",
  "schemaVersion": 1,
  "policyId": "taskdeck.smart-ci.v1",
  "mode": "shadow",
  "description": "Smart CI Fabric policy (ADR-0066). SHADOW MODE: the planner and the observation gate change no ci-required.yml job selection. Lanes name the real check contexts of the required workflow so the gate can verify them later. Unknown paths, control-path changes, planner errors and non-trusted actors escalate to the full hosted plan.",
  "defaultExecutionMode": "hosted",
  "failClosed": true,
  "trustedAssociations": ["OWNER", "MEMBER"],
  "runnerClasses": {
    "hostedLinux": { "labels": ["ubuntu-latest"], "hosted": true },
    "hostedWindows": { "labels": ["windows-latest"], "hosted": true },
    "selfHostedLinuxHeavy": { "labels": ["self-hosted", "taskdeck", "trusted", "linux", "x64", "heavy"], "hosted": false },
    "selfHostedWindowsCompat": { "labels": ["self-hosted", "taskdeck", "trusted", "windows", "x64", "compatibility"], "hosted": false }
  },
  "trustClasses": {
    "T0": { "description": "control-plane code from the protected base (planner, gate, policy) - never assigned to a change", "selfHostedAllowed": false },
    "T1": { "description": "same-repository change by the owner or a member, no control path touched", "selfHostedAllowed": true },
    "T2": { "description": "same-repository change that touches a control path (workflows, ci/, scripts/ci, bootstrap, security config)", "selfHostedAllowed": false },
    "T3": { "description": "fork, bot (Dependabot-like), collaborator without elevated trust, or ambiguous actor", "selfHostedAllowed": false },
    "T4": { "description": "protected tag / release", "selfHostedAllowed": false }
  },
  "riskClasses": {
    "R0": { "description": "documentation and inert metadata", "requiredLanes": [], "fullPlan": false },
    "R1": { "description": "isolated component, tests, or a local script without release/security effect", "requiredLanes": [], "fullPlan": false },
    "R2": { "description": "ordinary product change (service, endpoint, store, frontend flow) without a migration or security boundary", "requiredLanes": [], "fullPlan": false },
    "R3": { "description": "cross-cutting or stateful: persistence/migrations, auth, executor, MCP process/transport, launchers, containers, worker protocol", "requiredLanes": ["e2e-smoke", "backend-architecture", "migration-validation"], "fullPlan": false },
    "R4": { "description": "CI, release, supply-chain or security control - always the full plan, always hosted", "requiredLanes": [], "fullPlan": true }
  },
  "alwaysLanes": ["smart-ci-plan", "docs-governance", "secret-scan", "dependency-security", "sast-scan"],
  "lanes": {
    "smart-ci-plan": { "checkName": "Smart CI / Plan", "family": "control", "runner": "hostedLinux", "trustedOnly": false, "description": "base-ref planner (pull_request_target, read-only, no head execution)" },
    "smart-ci-self-test": { "checkName": "Smart CI / Planner Self-Test", "family": "control", "runner": "hostedLinux", "trustedOnly": false, "description": "head-side planner/gate/action-pin self-tests (pull_request)" },
    "docs-governance": { "checkName": "Docs Governance / Docs Governance", "family": "control", "runner": "hostedLinux", "trustedOnly": false, "description": "active-doc, golden-principles, GitHub-ops and agentic governance" },
    "worktree-helper-windows": { "checkName": "Docs Governance / Worktree Helper (Windows PowerShell)", "family": "windows", "runner": "selfHostedWindowsCompat", "trustedOnly": true, "hostedFallback": "hostedWindows", "description": "detached-first worktree helper regression harness (a Windows contract)" },
    "release-workflow-contract": { "checkName": "Release Workflow Contract", "family": "control", "runner": "hostedLinux", "trustedOnly": false, "description": "release-desktop dispatch hardening contract" },
    "backend-architecture": { "checkName": "Backend Architecture / Backend Architecture", "family": "backend", "runner": "hostedLinux", "trustedOnly": false, "description": "layer boundary tests" },
    "backend-unit-linux": { "checkName": "Backend Unit / Backend Unit (ubuntu-latest)", "family": "backend", "runner": "selfHostedLinuxHeavy", "trustedOnly": true, "hostedFallback": "hostedLinux", "description": "Domain / Application / CLI unit tests - the Linux semantic baseline" },
    "backend-unit-windows": { "checkName": "Backend Unit / Backend Unit (windows-latest)", "family": "windows", "runner": "selfHostedWindowsCompat", "trustedOnly": true, "hostedFallback": "hostedWindows", "description": "Domain / Application / CLI unit tests on Windows (full duplicate today; contract subset after CI-07)" },
    "api-integration-linux": { "checkName": "API Integration / API Integration (ubuntu-latest)", "family": "backend", "runner": "selfHostedLinuxHeavy", "trustedOnly": true, "hostedFallback": "hostedLinux", "description": "API integration suite on Linux" },
    "api-integration-windows": { "checkName": "API Integration / API Integration (windows-latest)", "family": "windows", "runner": "selfHostedWindowsCompat", "trustedOnly": true, "hostedFallback": "hostedWindows", "description": "API integration suite on Windows (full duplicate today; MCP/process/SQLite contract shard after CI-06/CI-07)" },
    "migration-validation": { "checkName": "Migration Validation / Migration Validation", "family": "persistence", "runner": "hostedLinux", "trustedOnly": false, "description": "EF Core migration chain validation" },
    "source-launcher-linux": { "checkName": "Frontend Unit / Source Launcher (Linux)", "family": "launchers", "runner": "hostedLinux", "trustedOnly": false, "description": "source launcher regression, isolated from frontend semantics; Linux only under SC-3" },
    "frontend-unit-linux": { "checkName": "Frontend Unit / Frontend Unit (ubuntu-latest)", "family": "frontend", "runner": "selfHostedLinuxHeavy", "trustedOnly": true, "hostedFallback": "hostedLinux", "description": "lint + typecheck + build + coverage + bundle budget" },
    "frontend-unit-windows": { "checkName": "Frontend Unit / Frontend Unit (windows-latest)", "family": "windows", "runner": "selfHostedWindowsCompat", "trustedOnly": true, "hostedFallback": "hostedWindows", "description": "full frontend duplicate today; launcher/platform subset after CI-08 (launcher suite runs on the Linux leg only since CI-07 #2331)" },
    "paper-color-audit": { "checkName": "Paper Color Audit / Paper Color Audit", "family": "frontend", "runner": "hostedLinux", "trustedOnly": false, "description": "hex-literal regression gate" },
    "container-images": { "checkName": "Container Images / Container Images", "family": "containers", "runner": "selfHostedLinuxHeavy", "trustedOnly": true, "hostedFallback": "hostedLinux", "description": "compose validation + image build (+ artifact export today)" },
    "secret-scan": { "checkName": "Secret Scan / Gitleaks Scan", "family": "security", "runner": "hostedLinux", "trustedOnly": false, "description": "diff-scoped secret scan - required branch-protection context" },
    "dependency-security": { "checkName": "Dependency Security / Dependency Security Signals", "family": "security", "runner": "hostedLinux", "trustedOnly": false, "description": "vulnerable-dependency signals - required branch-protection context" },
    "sast-scan": { "checkName": "SAST Scan / SAST Scan (Semgrep)", "family": "security", "runner": "hostedLinux", "trustedOnly": false, "description": "Semgrep SAST - required branch-protection context" },
    "e2e-smoke": { "checkName": "E2E Smoke / E2E Smoke", "family": "journeys", "runner": "selfHostedLinuxHeavy", "trustedOnly": true, "hostedFallback": "hostedLinux", "description": "Playwright Chromium smoke (journey-selected after CI-08)" }
  },
  "controlPaths": [
    ".github/workflows/**",
    ".github/actions/**",
    ".github/dependabot.yml",
    ".github/release.yml",
    ".github/CODEOWNERS",
    ".github/actionlint.yaml",
    ".github/actionlint.yml",
    ".github/settings.yml",
    "CODEOWNERS",
    ".config/dotnet-tools.json",
    "nuget.config",
    "NuGet.Config",
    "backend/nuget.config",
    "backend/Directory.Build.targets",
    "package.json",
    "package-lock.json",
    ".npmrc",
    "**/.npmrc",
    "frontend/package-lock.json",
    "frontend/taskdeck-web/.nvmrc",
    ".nvmrc",
    "ci/**",
    "scripts/ci/**",
    "scripts/build-release.ps1",
    "scripts/build-release.sh",
    "scripts/deploy/**",
    "scripts/security/**",
    "global.json",
    "backend/Directory.Build.props",
    "backend/Directory.Packages.props",
    "frontend/taskdeck-web/package.json",
    "frontend/taskdeck-web/package-lock.json",
    ".gitleaks.toml",
    ".gitleaksignore",
    ".semgrepignore",
    ".semgrep/**"
  ],
  "pathGroups": [
    { "id": "docs", "patterns": ["docs/**", "**/*.md", "autodoc/**", "LICENSES/**", "LICENSE", ".github/ISSUE_TEMPLATE/**", ".github/pull_request_template.md", "design_handoff_taskdeck_paper/**"], "riskFloor": "R0", "lanes": ["docs-governance"] },
    { "id": "repo-metadata", "patterns": [".editorconfig", ".gitattributes", ".gitignore", ".dockerignore", ".prettierrc*", ".prettierignore"], "riskFloor": "R0", "lanes": [] },
    { "id": "agent-tooling", "patterns": [".claude/**", ".codex/**", "scripts/agent_hooks/**", "scripts/agentic/**", "AGENTS.md", "CLAUDE.md", "GEMINI.md"], "riskFloor": "R1", "lanes": ["docs-governance"] },
    { "id": "mcp-config", "patterns": [".mcp.json", "mcp*.example.json", "mcp-*.example.json"], "riskFloor": "R3", "lanes": ["api-integration-linux", "api-integration-windows"] },
    { "id": "worktree-helpers", "patterns": ["scripts/git/**", "scripts/worktree_guard.ps1", "scripts/check-codex-path-trust.ps1", "scripts/github/**"], "riskFloor": "R2", "lanes": ["worktree-helper-windows", "docs-governance"] },
    { "id": "governance-scripts", "patterns": ["scripts/check-*.mjs", "scripts/check-*.test.mjs"], "riskFloor": "R2", "lanes": ["docs-governance"] },